icd_class,icd_class_short,icd3,deaths,mean_age,median_age,male_deaths,working_age_deaths,top_description,class_deaths,share_within_class,male_share,working_age_share,deaths_2016,deaths_2017,deaths_2018,deaths_2019,deaths_2020,deaths_2021,deaths_2022,deaths_2023,deaths_2024,deaths_2025,rank_within_class
IX,Кровообращение,I25,4157,73.24633148905461,74.0,2148,936,Другие формы хронической ишемической болезни сердца,17233,0.2412232344919631,0.5167187875872024,0.22516237671397643,1053.0,356.0,431.0,282.0,295.0,251.0,321.0,369.0,409.0,390.0,1
IX,Кровообращение,I63,2211,72.18543645409316,72.0,1012,549,"Инфаркт мозга, вызванный тромбозом мозговых артерий",17233,0.1283003539720304,0.4577114427860697,0.24830393487109906,357.0,284.0,275.0,240.0,212.0,224.0,162.0,173.0,155.0,129.0,2
IX,Кровообращение,I21,1955,65.55652173913043,66.0,1289,903,Острый трансмуральный инфаркт передней стенки миокарда,17233,0.11344513433528695,0.6593350383631713,0.4618925831202046,252.0,190.0,201.0,160.0,184.0,198.0,186.0,194.0,198.0,192.0,3
IX,Кровообращение,I69,1446,73.4460580912863,74.0,684,279,Последствия инфаркта мозга,17233,0.08390877966691812,0.4730290456431535,0.19294605809128632,52.0,92.0,114.0,169.0,192.0,176.0,172.0,144.0,171.0,164.0,4
IX,Кровообращение,I61,1220,61.82868852459016,62.0,741,704,Внутримозговое кровоизлияние в полушарие субкортикальное,17233,0.07079440608135554,0.6073770491803279,0.5770491803278689,177.0,132.0,150.0,136.0,101.0,114.0,108.0,98.0,102.0,102.0,5
IX,Кровообращение,I42,1076,60.05576208178439,60.0,710,660,Дилатационная кардиомиопатия,17233,0.06243834503568734,0.6598513011152416,0.6133828996282528,165.0,55.0,69.0,53.0,81.0,71.0,129.0,141.0,163.0,149.0,6
IX,Кровообращение,I80,975,70.18461538461538,70.0,404,310,Флебит и тромбофлебит других глубоких сосудов нижних конечностей,17233,0.0565774966633784,0.41435897435897434,0.31794871794871793,34.0,73.0,109.0,134.0,151.0,112.0,106.0,94.0,66.0,96.0,7
IX,Кровообращение,I67,828,79.61111111111111,81.5,253,58,Другие уточненные поражения сосудов мозга,17233,0.04804735101259212,0.3055555555555556,0.07004830917874397,140.0,30.0,9.0,6.0,62.0,35.0,138.0,154.0,104.0,150.0,8
IX,Кровообращение,I70,582,74.83848797250859,74.0,300,104,Атеросклероз артерий конечностей,17233,0.033772413392908956,0.5154639175257731,0.17869415807560138,55.0,62.0,81.0,64.0,60.0,69.0,45.0,64.0,40.0,42.0,9
IX,Кровообращение,I24,386,58.27461139896373,60.0,280,262,Другие формы острой ишемической болезни сердца,17233,0.022398885858527243,0.7253886010362695,0.6787564766839378,319.0,42.0,1.0,2.0,6.0,7.0,2.0,3.0,1.0,3.0,10
IX,Кровообращение,I71,377,69.63129973474801,70.0,222,113,Аневризма грудной части аорты разорванная,17233,0.021876632043172983,0.5888594164456233,0.29973474801061006,32.0,21.0,48.0,40.0,50.0,34.0,28.0,47.0,35.0,42.0,11
IX,Кровообращение,I35,357,78.25770308123249,80.0,119,43,Аортальный (клапанный) стеноз,17233,0.0207160680090524,0.3333333333333333,0.12044817927170869,8.0,14.0,48.0,52.0,39.0,44.0,29.0,32.0,40.0,51.0,12
IX,Кровообращение,I22,350,67.56857142857143,67.0,236,141,Повторный инфаркт передней стенки миокарда,17233,0.020309870597110195,0.6742857142857143,0.40285714285714286,84.0,55.0,80.0,59.0,43.0,27.0,2.0,0.0,0.0,0.0,13
IX,Кровообращение,I46,273,53.62271062271062,54.0,218,211,"Внезапная сердечная смерть, так описанная",17233,0.01584169906574595,0.7985347985347986,0.7728937728937729,0.0,26.0,95.0,75.0,37.0,39.0,1.0,0.0,0.0,0.0,14
IX,Кровообращение,I60,239,57.33472803347281,56.0,109,158,Субарахноидальное кровоизлияние из средней мозговой артерии,17233,0.013868740207740963,0.4560669456066946,0.6610878661087866,35.0,38.0,30.0,29.0,28.0,17.0,7.0,20.0,21.0,14.0,15
IX,Кровообращение,I34,110,75.48181818181818,78.0,31,17,Митральная (клапанная) недостаточность,17233,0.006383102187663204,0.2818181818181818,0.15454545454545454,0.0,11.0,13.0,13.0,7.0,12.0,9.0,17.0,8.0,20.0,16
IX,Кровообращение,I11,91,65.08791208791209,65.0,56,44,Гипертензивная [гипертоническая] болезнь с преимущественным поражением сердца с (застойной) сердечной недостаточностью,17233,0.005280566355248651,0.6153846153846154,0.4835164835164835,25.0,8.0,11.0,15.0,10.0,13.0,4.0,1.0,2.0,2.0,17
IX,Кровообращение,I51,85,74.17647058823529,76.0,35,14,"Внутрисердечный тромбоз, не классифицированный в других рубриках",17233,0.004932397145012476,0.4117647058823529,0.16470588235294117,9.0,8.0,14.0,22.0,7.0,5.0,9.0,4.0,4.0,3.0,18
IX,Кровообращение,I33,82,46.97560975609756,43.0,62,72,Острый и подострый инфекционный эндокардит,17233,0.0047583125398943885,0.7560975609756098,0.8780487804878049,10.0,0.0,10.0,10.0,9.0,11.0,9.0,6.0,13.0,4.0,19
IX,Кровообращение,I62,69,56.63768115942029,56.0,49,51,Нетравматическое субдуральное кровоизлияние,17233,0.00400394591771601,0.7101449275362319,0.7391304347826086,11.0,13.0,5.0,8.0,5.0,3.0,4.0,6.0,7.0,7.0,20
IX,Кровообращение,I74,57,72.96491228070175,73.0,27,9,Эмболия и тромбоз артерий нижних конечностей,17233,0.0033076074972436605,0.47368421052631576,0.15789473684210525,4.0,7.0,6.0,4.0,4.0,6.0,7.0,8.0,8.0,3.0,21
IX,Кровообращение,I82,41,71.14634146341463,71.0,20,7,Эмболия и тромбоз других уточненных вен,17233,0.0023791562699471943,0.4878048780487805,0.17073170731707318,1.0,3.0,6.0,5.0,12.0,9.0,0.0,0.0,1.0,4.0,22
IX,Кровообращение,I08,36,70.22222222222223,72.0,7,10,Комбинированное поражение митрального и аортального клапанов,17233,0.0020890152614170487,0.19444444444444445,0.2777777777777778,3.0,3.0,1.0,7.0,6.0,2.0,2.0,2.0,6.0,4.0,23
IX,Кровообращение,I13,26,67.1923076923077,65.0,9,11,Гипертензивная болезнь с поражением почек и сердечной недостаточностью,17233,0.0015087332443567574,0.34615384615384615,0.4230769230769231,12.0,3.0,2.0,6.0,3.0,0.0,0.0,0.0,0.0,0.0,24
IX,Кровообращение,I40,25,45.32,46.0,13,21,Инфекционный миокардит,17233,0.0014507050426507283,0.52,0.84,2.0,1.0,4.0,2.0,4.0,4.0,4.0,0.0,0.0,4.0,25
IX,Кровообращение,I72,21,67.0,68.0,14,8,Аневризма и расслоение подвздошной артерии,17233,0.0012185922358266118,0.6666666666666666,0.38095238095238093,0.0,2.0,0.0,3.0,1.0,4.0,2.0,3.0,3.0,3.0,26
IX,Кровообращение,I05,19,69.3157894736842,67.0,4,4,Митральный стеноз с недостаточностью,17233,0.0011025358324145535,0.21052631578947367,0.21052631578947367,2.0,3.0,1.0,3.0,2.0,1.0,3.0,3.0,0.0,1.0,27
IX,Кровообращение,I83,19,63.578947368421055,62.0,12,11,Варикозное расширение вен нижних конечностей без язвы или воспаления,17233,0.0011025358324145535,0.631578947368421,0.5789473684210527,3.0,3.0,5.0,0.0,3.0,2.0,1.0,0.0,0.0,2.0,28
IX,Кровообращение,I36,16,76.3125,80.0,6,4,Неревматическая недостаточность трехстворчатого клапана,17233,0.0009284512272964661,0.375,0.25,0.0,0.0,0.0,3.0,6.0,4.0,0.0,0.0,0.0,3.0,29
IX,Кровообращение,I30,15,72.4,70.0,9,3,Острый неспецифический идиопатический перикардит,17233,0.0008704230255904369,0.6,0.2,5.0,0.0,3.0,0.0,0.0,5.0,0.0,1.0,0.0,1.0,30
IX,Кровообращение,I06,11,69.45454545454545,70.0,5,3,Ревматический аортальный стеноз с недостаточностью,17233,0.0006383102187663204,0.45454545454545453,0.2727272727272727,0.0,2.0,0.0,2.0,0.0,2.0,3.0,0.0,1.0,1.0,31
IX,Кровообращение,I12,11,78.0,83.0,4,1,Гипертензивная болезнь с почечной недостаточностью,17233,0.0006383102187663204,0.36363636363636365,0.09090909090909091,1.0,1.0,1.0,2.0,3.0,3.0,0.0,0.0,0.0,0.0,32
IX,Кровообращение,I26,10,59.3,67.5,6,4,Тромбоэмболия легочной артерии без острого легочным сердцем,17233,0.0005802820170602913,0.6,0.4,4.0,2.0,1.0,1.0,0.0,0.0,2.0,0.0,0.0,0.0,33
IX,Кровообращение,I31,9,62.666666666666664,68.0,7,4,Хронический перикардит,17233,0.0005222538153542622,0.7777777777777778,0.4444444444444444,0.0,3.0,1.0,1.0,1.0,1.0,2.0,0.0,0.0,0.0,34
IX,Кровообращение,I28,7,68.28571428571429,67.0,3,2,Другие уточненные болезни легочных сосудов,17233,0.0004061974119422039,0.42857142857142855,0.2857142857142857,1.0,2.0,0.0,0.0,1.0,1.0,0.0,1.0,1.0,0.0,35
IX,Кровообращение,I64,6,73.66666666666667,72.0,2,2,Инсульт неуточненный как геморрагический или ишемический,17233,0.0003481692102361748,0.3333333333333333,0.3333333333333333,6.0,0.0,0.0,0.0,0.0,0.0,0.0,0.0,0.0,0.0,36
IX,Кровообращение,I73,6,57.5,51.5,5,4,Облитерирующий тромбангиит [болезнь Бюргера],17233,0.0003481692102361748,0.8333333333333334,0.6666666666666666,0.0,0.0,0.0,1.0,3.0,1.0,0.0,1.0,0.0,0.0,37
IX,Кровообращение,I87,4,65.25,65.0,2,2,Посттромботический синдром,17233,0.00023211280682411653,0.5,0.5,0.0,0.0,0.0,0.0,0.0,0.0,1.0,0.0,1.0,2.0,38
IX,Кровообращение,I27,3,57.666666666666664,54.0,0,2,Первичная легочная гипертензия,17233,0.0001740846051180874,0.0,0.6666666666666666,1.0,1.0,0.0,0.0,0.0,0.0,0.0,0.0,1.0,0.0,39
IX,Кровообращение,I48,3,78.0,86.0,2,1,Фибрилляция и трепетание предсердий,17233,0.0001740846051180874,0.6666666666666666,0.3333333333333333,1.0,1.0,0.0,1.0,0.0,0.0,0.0,0.0,0.0,0.0,40
IX,Кровообращение,I66,3,67.66666666666667,64.0,2,2,Закупорка мозговой артерии средней,17233,0.0001740846051180874,0.6666666666666666,0.6666666666666666,3.0,0.0,0.0,0.0,0.0,0.0,0.0,0.0,0.0,0.0,41
IX,Кровообращение,I44,2,43.5,43.5,1,2,Атриовентрикулярная блокада III степени,17233,0.00011605640341205826,0.5,1.0,1.0,0.0,1.0,0.0,0.0,0.0,0.0,0.0,0.0,0.0,42
IX,Кровообращение,I45,2,34.0,34.0,2,2,Синдром преждевременного возбуждения,17233,0.00011605640341205826,1.0,1.0,0.0,0.0,0.0,1.0,0.0,0.0,1.0,0.0,0.0,0.0,43
IX,Кровообращение,I85,2,51.0,51.0,2,1,Варикозное расширение вен пищевода с кровотечением,17233,0.00011605640341205826,1.0,0.5,1.0,1.0,0.0,0.0,0.0,0.0,0.0,0.0,0.0,0.0,44
IX,Кровообращение,I89,2,61.5,61.5,1,1,Другие болезни лимфатических узлов,17233,0.00011605640341205826,0.5,0.5,0.0,0.0,0.0,0.0,0.0,1.0,0.0,0.0,0.0,1.0,45
IX,Кровообращение,I09,1,68.0,68.0,0,0,Другие уточненные ревматические болезни сердца,17233,5.802820170602913e-05,0.0,0.0,0.0,0.0,0.0,0.0,0.0,0.0,1.0,0.0,0.0,0.0,46
IX,Кровообращение,I10,1,64.0,64.0,0,1,Эссенциальная (первичная) гипертензия,17233,5.802820170602913e-05,0.0,1.0,0.0,0.0,0.0,1.0,0.0,0.0,0.0,0.0,0.0,0.0,47
IX,Кровообращение,I20,1,64.0,64.0,1,1,Нестабильная стенокардия,17233,5.802820170602913e-05,1.0,1.0,0.0,0.0,0.0,0.0,0.0,0.0,0.0,0.0,1.0,0.0,48
IX,Кровообращение,I37,1,45.0,45.0,1,1,Стеноз клапана легочной артерии,17233,5.802820170602913e-05,1.0,1.0,0.0,0.0,0.0,0.0,0.0,0.0,0.0,0.0,0.0,1.0,49
IX,Кровообращение,I38,1,45.0,45.0,0,1,Эндокардит неуточненный,17233,5.802820170602913e-05,0.0,1.0,0.0,1.0,0.0,0.0,0.0,0.0,0.0,0.0,0.0,0.0,50
IX,Кровообращение,I49,1,78.0,78.0,1,0,Другие сердечные аритмии,17233,5.802820170602913e-05,1.0,0.0,0.0,0.0,1.0,0.0,0.0,0.0,0.0,0.0,0.0,0.0,51
IX,Кровообращение,I50,1,41.0,41.0,1,1,Сердечная недостаточность неуточненная,17233,5.802820170602913e-05,1.0,1.0,0.0,0.0,0.0,0.0,0.0,0.0,0.0,1.0,0.0,0.0,52
IX,Кровообращение,I77,1,71.0,71.0,0,0,Другие болезни артерий,17233,5.802820170602913e-05,0.0,0.0,0.0,0.0,0.0,0.0,0.0,1.0,0.0,0.0,0.0,0.0,53
II,Новообразования,C34,2332,66.45068610634648,66.0,1745,959,"Злокачественное новообразование бронхов или легкого, выходящее за пределы одной и более вышеуказанных локализаций",11353,0.20540826213335683,0.7482847341337907,0.41123499142367065,239.0,208.0,283.0,248.0,213.0,222.0,209.0,248.0,203.0,259.0,1
II,Новообразования,C16,1083,67.61034164358264,68.0,679,391,"Злокачественное новообразование желудка, выходящее за пределы одной и более вышеуказанных локализаций",11353,0.09539328811767815,0.6269621421975993,0.3610341643582641,115.0,123.0,116.0,126.0,88.0,102.0,102.0,111.0,106.0,94.0,2
II,Новообразования,C18,816,70.34191176470588,71.0,346,205,Злокачественное новообразование сигмовидной кишки,11353,0.07187527525764115,0.42401960784313725,0.2512254901960784,77.0,74.0,68.0,82.0,95.0,78.0,78.0,97.0,75.0,92.0,3
II,Новообразования,C25,775,67.07354838709678,67.0,363,298,Злокачественное новообразование головки поджелудочной железы,11353,0.06826389500572536,0.46838709677419355,0.38451612903225807,82.0,66.0,70.0,92.0,79.0,79.0,76.0,80.0,80.0,71.0,4
II,Новообразования,C50,675,65.4074074074074,66.0,7,306,"Злокачественное новообразование молочной железы, выходящее за пределы одной и более вышеуказанных локализаций",11353,0.05945565048885757,0.01037037037037037,0.4533333333333333,71.0,71.0,57.0,67.0,73.0,66.0,70.0,66.0,60.0,74.0,5
II,Новообразования,C22,552,65.35326086956522,66.0,375,254,Печеночноклеточный рак,11353,0.04862150973311019,0.6793478260869565,0.4601449275362319,63.0,62.0,54.0,64.0,44.0,52.0,46.0,57.0,63.0,47.0,6
II,Новообразования,C61,388,71.97680412371135,72.0,388,71,Злокачественное новообразование предстательной железы,11353,0.03417598872544702,1.0,0.18298969072164947,36.0,40.0,39.0,31.0,43.0,39.0,30.0,38.0,49.0,43.0,7
II,Новообразования,C15,374,64.70855614973262,65.0,285,178,"Злокачественное новообразование пищевода, выходящее за пределы одной и более вышеуказанных локализаций",11353,0.03294283449308553,0.7620320855614974,0.47593582887700536,44.0,49.0,40.0,44.0,47.0,32.0,28.0,30.0,37.0,23.0,8
II,Новообразования,C20,327,68.29969418960245,69.0,171,109,Злокачественное новообразование прямой кишки,11353,0.028802959570157667,0.5229357798165137,0.3333333333333333,20.0,25.0,25.0,34.0,35.0,33.0,39.0,42.0,40.0,34.0,9
II,Новообразования,C64,323,66.15170278637771,66.0,223,142,"Злокачественное новообразование почки, кроме почечной лоханки",11353,0.028450629789482956,0.6904024767801857,0.43962848297213625,29.0,42.0,25.0,40.0,29.0,40.0,26.0,28.0,34.0,30.0,10
II,Новообразования,C56,311,66.45659163987138,67.0,0,112,Злокачественное новообразование яичника,11353,0.02739364044745882,0.0,0.36012861736334406,24.0,33.0,37.0,29.0,32.0,31.0,27.0,38.0,34.0,26.0,11
II,Новообразования,C53,282,57.06028368794326,57.0,0,185,"Злокачественное новообразование шейки матки, выходящее за пределы одной и более вышеуказанных локализаций",11353,0.02483924953756716,0.0,0.6560283687943262,24.0,28.0,23.0,21.0,32.0,25.0,23.0,31.0,36.0,39.0,12
II,Новообразования,C67,262,69.95419847328245,70.0,193,78,"Злокачественное новообразование мочевого пузыря, выходящее за пределы одной и более вышеуказанных локализаций",11353,0.023077600634193604,0.7366412213740458,0.29770992366412213,37.0,25.0,27.0,32.0,22.0,14.0,31.0,10.0,36.0,28.0,13
II,Новообразования,C54,221,67.35746606334841,68.0,1,88,"Злокачественное новообразование тела матки, выходящее за пределы одной и более вышеуказанных локализаций",11353,0.019466220382277813,0.004524886877828055,0.39819004524886875,21.0,21.0,15.0,25.0,23.0,23.0,31.0,20.0,22.0,20.0,14
II,Новообразования,C71,220,60.86818181818182,64.0,114,110,"Злокачественное новообразование головного мозга, выходящее за пределы одной и более вышеуказанных локализаций",11353,0.019378137937109133,0.5181818181818182,0.5,17.0,23.0,22.0,21.0,25.0,14.0,19.0,32.0,20.0,27.0,15
II,Новообразования,C32,200,63.025,64.0,185,110,"Злокачественное новообразование гортани, выходящее за пределы одной и более вышеуказанных локализаций",11353,0.017616489033735576,0.925,0.55,29.0,22.0,18.0,19.0,29.0,14.0,17.0,20.0,17.0,15.0,16
II,Новообразования,C43,150,65.28666666666666,66.5,62,63,Злокачественная меланома туловища,11353,0.013212366775301682,0.41333333333333333,0.42,15.0,11.0,15.0,8.0,15.0,14.0,16.0,22.0,18.0,16.0,17
II,Новообразования,C19,120,70.15,69.0,54,28,Злокачественное новообразование ректосигмоидного соединения,11353,0.010569893420241346,0.45,0.23333333333333334,5.0,10.0,14.0,14.0,17.0,14.0,11.0,8.0,15.0,12.0,18
II,Новообразования,C97,110,69.86363636363636,71.0,59,26,Злокачественное новообразование самостоятельных (первичных) множественных локализаций,11353,0.009689068968554567,0.5363636363636364,0.23636363636363636,6.0,15.0,25.0,19.0,29.0,11.0,2.0,2.0,0.0,1.0,19
II,Новообразования,C10,106,62.405660377358494,63.0,81,63,"Злокачественное новообразование ротоглотки, выходящее за пределы одной и более вышеуказанных локализаций",11353,0.009336739187879856,0.7641509433962265,0.5943396226415094,11.0,15.0,11.0,13.0,8.0,12.0,10.0,10.0,8.0,8.0,20
II,Новообразования,C92,87,65.64367816091954,68.0,52,32,Острый миелобластный лейкоз [ОМЛ],11353,0.007663172729674976,0.5977011494252874,0.367816091954023,5.0,13.0,6.0,10.0,3.0,6.0,8.0,8.0,13.0,15.0,21
II,Новообразования,C90,86,68.03488372093024,69.5,37,30,Множественная миелома,11353,0.0075750902845062975,0.43023255813953487,0.3488372093023256,11.0,5.0,8.0,6.0,10.0,11.0,9.0,8.0,8.0,10.0,22
II,Новообразования,C91,76,63.96052631578947,69.0,52,24,В-клеточный хронический лимфоцитарный лейкоз,11353,0.006694265832819519,0.6842105263157895,0.3157894736842105,3.0,14.0,5.0,6.0,9.0,9.0,5.0,10.0,11.0,4.0,23
II,Новообразования,C83,75,62.49333333333333,64.0,44,38,Диффузная В-крупноклеточная лимфома,11353,0.006606183387650841,0.5866666666666667,0.5066666666666667,9.0,6.0,9.0,7.0,8.0,9.0,3.0,3.0,9.0,12.0,24
II,Новообразования,C13,73,61.21917808219178,62.0,64,44,"Злокачественное новообразование нижней части глотки, выходящее за пределы одной и более вышеуказанных локализаций",11353,0.0064300184973134855,0.8767123287671232,0.6027397260273972,5.0,4.0,14.0,8.0,12.0,9.0,5.0,7.0,6.0,3.0,25
II,Новообразования,C24,73,66.05479452054794,67.0,31,29,Злокачественное новообразование внепеченочного желчного протока,11353,0.0064300184973134855,0.4246575342465753,0.3972602739726027,7.0,6.0,4.0,2.0,8.0,9.0,3.0,11.0,11.0,12.0,26
II,Новообразования,C04,68,60.9264705882353,59.0,49,45,"Злокачественное новообразование дна полости рта, выходящее за пределы одной и более вышеуказанных локализаций",11353,0.005989606271470096,0.7205882352941176,0.6617647058823529,9.0,8.0,8.0,6.0,3.0,8.0,7.0,2.0,11.0,6.0,27
II,Новообразования,C02,62,60.67741935483871,61.0,40,36,"Злокачественное новообразование языка, выходящее за пределы одной и более вышеуказанных локализаций",11353,0.005461111600458029,0.6451612903225806,0.5806451612903226,8.0,3.0,9.0,4.0,7.0,7.0,7.0,10.0,3.0,4.0,28
II,Новообразования,C21,52,64.40384615384616,65.5,19,23,"Злокачественное новообразование прямой кишки, заднего прохода [ануса] и анального канала, выходящее за пределы вышеуказанных локализаций",11353,0.00458028714877125,0.36538461538461536,0.4423076923076923,4.0,4.0,15.0,10.0,5.0,2.0,4.0,3.0,4.0,1.0,29
II,Новообразования,C45,52,70.28846153846153,71.0,22,13,Мезотелиома плевры,11353,0.00458028714877125,0.4230769230769231,0.25,6.0,9.0,1.0,2.0,5.0,4.0,5.0,7.0,7.0,6.0,30
II,Новообразования,C49,50,65.24,69.0,31,15,"Злокачественное новообразование соединительной и мягких тканей нижней конечности, включая тазобедренную область",11353,0.004404122258433894,0.62,0.3,2.0,4.0,12.0,5.0,2.0,5.0,2.0,5.0,7.0,6.0,31
II,Новообразования,C44,45,70.17777777777778,69.0,18,14,Другие злокачественные новообразования кожи других и неуточненных частей лица,11353,0.003963710032590505,0.4,0.3111111111111111,6.0,4.0,9.0,4.0,8.0,2.0,3.0,4.0,1.0,4.0,32
II,Новообразования,C17,44,68.13636363636364,70.0,17,14,Злокачественное новообразование двенадцатиперстной кишки,11353,0.003875627587421827,0.38636363636363635,0.3181818181818182,5.0,5.0,1.0,4.0,3.0,5.0,6.0,8.0,4.0,3.0,33
II,Новообразования,C48,37,63.7027027027027,64.0,12,18,Злокачественное новообразование забрюшинного пространства,11353,0.0032590504712410816,0.32432432432432434,0.4864864864864865,8.0,8.0,6.0,4.0,2.0,4.0,0.0,3.0,2.0,0.0,34
II,Новообразования,D43,37,65.16216216216216,68.0,18,15,Новообразование неопределенного или неизвестного характера головного мозга над мозговым наметом,11353,0.0032590504712410816,0.4864864864864865,0.40540540540540543,3.0,5.0,7.0,6.0,1.0,4.0,4.0,3.0,1.0,3.0,35
II,Новообразования,D32,36,71.72222222222223,72.0,5,10,Доброкачественное новообразование оболочек головного мозга,11353,0.003170968026072404,0.1388888888888889,0.2777777777777778,4.0,4.0,3.0,3.0,3.0,4.0,5.0,3.0,7.0,0.0,36
II,Новообразования,C51,32,68.21875,73.5,0,11,"Злокачественное новообразование вульвы, выходящее за пределы одной и более вышеуказанных локализаций",11353,0.0028186382453976922,0.0,0.34375,0.0,3.0,3.0,9.0,7.0,2.0,2.0,2.0,4.0,0.0,37
II,Новообразования,C85,32,66.46875,68.5,14,14,B-клеточная лимфома неуточненная,11353,0.0028186382453976922,0.4375,0.4375,5.0,3.0,4.0,4.0,4.0,5.0,3.0,2.0,1.0,1.0,38
