Позиция,Назначение,Заполнено,Доля записей,Совпадает с первоначальной причиной,Доля совпадений среди заполненных
Причина а,непосредственная причина или терминальное осложнение,596,"37,0%",336,"56,4%"
Причина б,промежуточное звено цепочки,335,"20,8%",3,"0,9%"
Причина в,часто место фиксации первоначальной причины,1 110,"69,0%",1 110,"100,0%"
Причина г,нижняя строка цепочки / внешняя или фоновая причина,760,"47,2%",0,"0,0%"
Прочие состояния,"состояния, способствовавшие смерти, но не входящие в основную цепочку",253,"15,7%",167,"66,0%"
